{
  "schema_version": "v1.0",
  "generated_at": "2026-05-29T08:15:20.865256+00:00",
  "service_name": "TimeSeriesService",
  "request_id": null,
  "viewer_state": {
    "mode": "time",
    "window_type": "2hour",
    "slider_value": -3,
    "display_label": "past 3",
    "time_type": "past",
    "is_history": true,
    "is_current": false,
    "is_future": false
  },
  "summary": {
    "total_station_count": 3,
    "normal_count": null,
    "warning_count": null,
    "predict_risk_count": null
  },
  "stations": [
    {
      "line_id": "line_1",
      "station_name_zh": "底漆站",
      "station_name_en": "Primer Station",
      "state": null,
      "component_overview": [],
      "metrics": {
        "availability_pct": 95.0,
        "clog_rate_pct": 2.203856749311299,
        "pressure_bar": 2.5,
        "flow_rate_ml_min": 119.0,
        "maintainability_pct": 80.0,
        "quality_score_pct": 96.0,
        "risk_text": null,
        "spray_width_mm": 52.333333333333336
      },
      "process_parameters": {
        "recipe_name": "Primer_A",
        "temperature_c": 27.96666666666667,
        "utilization_pct": 77.77777777777779,
        "cycle_time_sec": 42
      },
      "component_metrics": {
        "nozzle": {
          "pressure_bar": 2.5,
          "flow_rate_ml_min": 119.0,
          "nozzle_clog_rate_pct": 0.8333333333333334,
          "nozzle_maintainability_pct": 80.0
        },
        "filter_mesh": {
          "flow_loss_pct": 2.203856749311299,
          "filter_clog_rate_pct": 2.203856749311299,
          "filter_maintainability_pct": 80.0
        },
        "spray_width": {
          "spray_width_mm": 52.333333333333336,
          "width_error_mm": 0.3333333333333357,
          "width_error_pct": 0.6410256410256456,
          "coverage_score_pct": 99.35897435897435,
          "target_min_mm": 48,
          "target_max_mm": 56
        }
      },
      "fault_detail": [],
      "spray_width_image": {
        "spray_width_mm": 52.333333333333336,
        "target_min_mm": 48,
        "target_max_mm": 56,
        "status": null,
        "image_ref": null,
        "note": null
      }
    },
    {
      "line_id": "line_2",
      "station_name_zh": "面漆站",
      "station_name_en": "Topcoat Station",
      "state": null,
      "component_overview": [],
      "metrics": {
        "availability_pct": 88.88888888888889,
        "clog_rate_pct": 12.538226299694195,
        "pressure_bar": 2.033333333333333,
        "flow_rate_ml_min": 99.0,
        "maintainability_pct": 41.86046511627907,
        "quality_score_pct": 91.0,
        "risk_text": null,
        "spray_width_mm": 49.666666666666664
      },
      "process_parameters": {
        "recipe_name": "Topcoat_B",
        "temperature_c": 27.099999999999998,
        "utilization_pct": 72.22222222222221,
        "cycle_time_sec": 46
      },
      "component_metrics": {
        "nozzle": {
          "pressure_bar": 2.033333333333333,
          "flow_rate_ml_min": 99.0,
          "nozzle_clog_rate_pct": 10.0,
          "nozzle_maintainability_pct": 55.00000000000001
        },
        "filter_mesh": {
          "flow_loss_pct": 12.538226299694195,
          "filter_clog_rate_pct": 12.538226299694195,
          "filter_maintainability_pct": 41.86046511627907
        },
        "spray_width": {
          "spray_width_mm": 49.666666666666664,
          "width_error_mm": -2.3333333333333357,
          "width_error_pct": 4.487179487179492,
          "coverage_score_pct": 95.51282051282051,
          "target_min_mm": 48,
          "target_max_mm": 56
        }
      },
      "fault_detail": [],
      "spray_width_image": {
        "spray_width_mm": 49.666666666666664,
        "target_min_mm": 48,
        "target_max_mm": 56,
        "status": null,
        "image_ref": null,
        "note": null
      }
    },
    {
      "line_id": "line_3",
      "station_name_zh": "金漆站",
      "station_name_en": "Gold Paint Station",
      "state": null,
      "component_overview": [],
      "metrics": {
        "availability_pct": 72.22222222222221,
        "clog_rate_pct": 42.33983286908079,
        "pressure_bar": 1.6333333333333335,
        "flow_rate_ml_min": 81.0,
        "maintainability_pct": 16.666666666666664,
        "quality_score_pct": 82.0,
        "risk_text": null,
        "spray_width_mm": 42.666666666666664
      },
      "process_parameters": {
        "recipe_name": "Gold_C",
        "temperature_c": 26.099999999999998,
        "utilization_pct": 58.333333333333336,
        "cycle_time_sec": 55
      },
      "component_metrics": {
        "nozzle": {
          "pressure_bar": 1.6333333333333335,
          "flow_rate_ml_min": 81.0,
          "nozzle_clog_rate_pct": 32.5,
          "nozzle_maintainability_pct": 25.0
        },
        "filter_mesh": {
          "flow_loss_pct": 42.33983286908079,
          "filter_clog_rate_pct": 42.33983286908079,
          "filter_maintainability_pct": 16.666666666666664
        },
        "spray_width": {
          "spray_width_mm": 42.666666666666664,
          "width_error_mm": -9.333333333333336,
          "width_error_pct": 17.948717948717956,
          "coverage_score_pct": 82.05128205128204,
          "target_min_mm": 48,
          "target_max_mm": 56
        }
      },
      "fault_detail": [],
      "spray_width_image": {
        "spray_width_mm": 42.666666666666664,
        "target_min_mm": 48,
        "target_max_mm": 56,
        "status": null,
        "image_ref": null,
        "note": null
      }
    }
  ],
  "calculation_info": {
    "pipeline": [
      "HandleTimeSeriesQuery",
      "DetermineTimeType",
      "QueryData",
      "ApplySampleMethods",
      "CalculateLineMetrics",
      "BuildOutput"
    ],
    "rule_stage": "external",
    "note": "This service calculates metric values only. Rule Service should decide state, risk_text, fault_detail, and component_overview."
  }
}
